text,contest
She left me for an engine that could.,497
I just feel there's no light at the end of the tunnel.,497
No one wants to hire a whistleblower.,497
We uncoupled.,497
Sometimes you only think you can.,497
"Not my desk, you idiot! The chair!",499
Not another hostile takeover.,499
I need to take this. It’s my wife.,499
Put him through.,499
"I'm sorry, I have to take this.",499
Trigger warning: I don't believe in litter boxes.,505
"I get it, you're a working stiff.",505
"I know what you're thinking ... he's just another working stiff, just like every other one she's brought home .... 
I hope it doesn't clash with the furniture.
Feminism. Crushing every ounce of pride this man had since marriage.
See you later crocodile indeed!
Alright, what did you do with the dog?
Martha, I think something is wrong with the dog.
'Wipe that defenseless animal-eating grin off your face!'
Did you hear that, Stan? I said I'm leaving you, and I'm taking our accountant with me.
When I said 'Later, gator,' I did not mean you could stay out this late.
Hold it there for a second Gary, let me get the towel to wipe your feet.
That reminds me, I could use a new pair of shoes.
GOT SHOES?
What's that ticking sound?
Where's my dog?
Honey, I know what happened to the dog now.
Well, I'll be. Didn't I release you in Florida last year?
Phew, I thought it was a Jehovah's Witness
How was your prey?
We're here for the negotiation, and I have to warn you, one of us isn't flexible.
You're supposed to be using the alley door!
Didn't I say I'd see you later, alligator?
We need to work on our definition of 'later'.
You'll be the pet, since you ate my cat.
You're not my Fido!
You look like the caiman that swallowed the cat.
This could end with crocodile tears.
I wouldn't really consider that a Watergate.
These aren't the shoes you are looking for.
I told you I'd see you later.
Did you do your business!
The neighbor called. He says his muskrat is missing.
I thought I said, See you later.
If you're looking for the Puss 'N' Boots, it's in the kitchen.
Where were you? The neighbors have been worried sick about their pets.
Phyllis, you're never going to believe what the cat brought home this time.
This doesn't look good for the dog.
Where have you been? The whole neighborhood has been worried sick wondering where you were.
What have you done with Dr. Millmoss?
Dog gone!
I take it you won't be negotiating any further?
I see you finally learned to use the crocadoor.
Ma, you gotta stop taxing people.
That was an awfully quick trip out to do potty.
Where's Fluffy?
Where's the newspaper?
I told you I'm a Catholic!
Bring a man to work day
Just give the neighbors time to get use to you.
Don't start with the tears.
One more Amber Alert and you're on a leash!
It's been more than a while.
Come on Buddy, that costume is a crock.
What you need is a good stiff drink.
Not again! What poor creature have you caught to show me this time?
What have you done with Fifi?
Another walk of shame?
Wanna wrestle?
I should have gotten the boots.
Sir fluffles! Did you burry my glasses again?
'Where were you last night? You smell like a sewer.'
Bad alligator! You've been out with that crocodile again, haven't you!
Do you want to talk about the dog that just went out this door?
I just hope you made friends with Fido next door!
Wally, now tell the truth, why did Fifi stop barking?
You know you're supposed to let Crusty in first.
You have to stop losing your collar.
Look what the cat dragged in.
I'm so over all these extra uninvited house guests!!!! They all just sneak in through the back door . BECAUSE THEY CAN",505
Wait! This is the lawyer's entrance.,505
"Go back out that door right now! By the look of your feet, you'd think you lived in mud!",505
Wall Street convict.,507
... the Boxer Rebellion.,507
"Yes, my name is Frank but don't hate me for it.",507
"OK, you can tell the boss I'll take a dive in the 8th, but I don't think it's going to be very believable.",507
We're economizing on work dinners.,507
Do YOU remember what you had for lunch last Thursday?,508
I suppose now you plan to grill me.,508
I'm not sure. What does the other leg look like?,508
I prefer the term 'high interest lender.',508
"Yeah, maybe I did. Like I said, I eat a lot of people.",508
I recommend the trout.,509
"Take my wife, please!",509
All that work to die a virgin.,509
Shouldn't you be preventing forest fires somewhere?,509
And mom said it wouldn't kill me to have kids.,509
"Best case this is his dream, and we don't really exist.",510
I prefer sexual objectification.,510
"I escaped from a fish farm - you'd probably prefer that locally-sourced, wild fellow.",510
"Hey buddy, can you cut me some slack? I just spent 4 years in the ocean, swam 1000 miles upriver, and just want a little action.",510
"On second thought, my childhood wasn't that great.",510
"Yeah, but the rent is more reasonable than you'd expect in Park Slope.",511
My boss says I need to be more mindful.,511
Whadya mean What am I doing here? I'm the latest conceptual art installation from the Museum of Contemporary Art.,511
A New York state of mind.,511
"Good Lord, how many cats do you have?",511
It's my new weight loss program!,512
"Had enough, big shot?",512
You're overcompensating for a weak second chakra.,512
How much bliss do you need?,512
"No, I don't want a magic carpet ride.",512
"What an honor to be Bloomberg's pallbearer, right?",513
Just sharing the workload,513
I didn't think this is what you meant by file sharing...,513
I still say he wanted a three piece suit.,513
Now do you grasp what the PM meant by 'three ministers with portfolio'?,513
Sometimes I think the sharing economy has gone too far.,514
And you said long form was dead.,514
Damn these low emission vehicles!,514
We'll rock till you drop.,514
"If they catch us we're gonna be breakin' rocks, not breakin' rockers.",514
"Go ahead and shoot, we're all carrying cap guns.",515
We go through this every Saturday at bath time,515
The voices in my head are screaming ' Here comes that train again ! ',515
I lost my train of thought.,515
"Now that you're comfortable with planes and buses, let's try to attack your next phobia.",515
You sound like Chicken Little.,516
Ever have one of those days?,516
"Wait a second, I can't remember if we're covered under Medicare part A, GG, or D train!!",516
I certainly don't know what could be worse than the construction dust?,516
And then it hit me...,516
"So I told her, 'Come on babe, live every moment like it's your last.'",517
A concrete metaphor comes to mind....,517
This place attracts a lot of movers and shakers.,517
They can't prove a thing without the scythe.,517
A life sentence? Are you sure?,517
Maybe it's time you think outside the box.,518
"Mr. Unabomber, your legal fees are paid by ISIS.",518
Not to worry. Your face doesn't show up on any of the security cameras.,518
How vague my broker suggest the plaything of my thoughts to invest. . . ?,518
He needs to stink outside the box.,518
He doesn't play well with others.,519
ignorance is bliss,519
Two clear cases of A.D.D.,519
Crazy is what crazy does.,519
He's too cheap to buy binoculars.,519
does Dave know what he's doing?,520
Tell me why you feel that you’re just a shell of your old self.,520
"So, how was week's experiment with oral sex?",520
"All things considered, I'd say thinking about bananas all the time is not a sexual thing in your case.",520
Tell me more about the tally man.,520
It sounds to me like you're on a journey to find inner piece.,521
I can't afford to build an ark.,521
"Yes, it really is HUUUGE.",521
And it's great at angry shareholder meetings.,521
You make me feel so whatever-comes-after-daring.,521
"It's not very good when it's windy but, at least, I'll never forget it on the bus.",522
This town may not be big enough for the two,522
Don't laugh. It beats online dating.,522
"Should I turn my power on now, sir?",522
"Shall I prepare the guest suite, or will he be an outpatient?",522
Sir. Solar panels were a bad idea.,523
This job is killing me.,523
Close your eyes and relax to sounds of the jungle.,523
I liked it better when you were the cat lady.,523
Maybe a barrel was too much...,523
"Don't blame me honey, it was your mother who Christmas gifted me a copy of : Getting Into The Monkey Business For Dummies.",524
Event Number Four: Medieval Decathlon,524
"By George, they will make me a saint.",524
"So, that's why they call you Puff.",524
Why not just incinerate me? Well because you don't want to labeled a one trick dragon now do you?,524
That's how we roll.,526
It’s true! He calls me His co-pilot.,526
I got it at a garage sale.,526
"You wanted a bigger halo, yes it is razor sharp.",526
You had me at Halo.,526
Don't you think it is a bit stupid to watch a contest between an elephant and a donkey?,531
It's turned off. That's your reflection.,531
Wide-screen... I just don't see the appeal.,531
Aren't these reality shows on Wild Kingdom great!,531
There's nothing good on TV--wanna' neck?,531
"My methods are Jungian. Sometimes a bar of soap *is* just a bar of soap, you know...",591
Some of my patients find the loofah less threatening.,591
It'll keep you Jung.,591
I hope you don't mind. My couch is brand new.,591
Immersion therapy washes away the guilt ... and exfoliates as it cleans.,591
"I know, but you had to spend twenty minutes filling the tub.",591
Do you ever want to wring your own neck?,592
The answer to number seven? I can’t even turn this thing on.,592
"Back to work birds, and enough with the wisequacks!",592
"Him? He's a pwoblem duck, stwessed out and weady to quack.",592
I'm only in it for the bread.,592
"""And the best, they work for birdseed !'",592
The rats wouldn't perform without a mouse.,592
The experiment was successful; all the ducks are in a row.,592
"When I snap my fingers, you will go home, eat breadcrumbs and crap all over the park.",592
I’m surprised. I really thought they would fly through this training.,592
A little redundant don't you think? You have all your ducks in a row and online.,592
"I can't explain this, maybe we will find a reasonable explanation in next week's New Yorker.",592
They wanted more accurate data on fly-over states.,592
That rebel in the third row? Let’s just eat him.,592
This might be the reason it always autocorrects to 'ducking',592
Its nice that they got us new computers. But these are neither web nor wing friendly.,592
And these are the exchange students from the University of Oregon.,592
We're trying to teach them the hunt and peck method.,592
"They're great tweeters, but hard on the touch screens.",592
"Okay class, Miss Givens will now walk you through using Google Maps to plan flights south.",592
Ummm…I suspect the directive wasn’t “quack the code”.,592
Haven't you ever seen an IT department before?,592
Shouldn't we be facing south for the winter semester?,592
Isn't this experiment supposed to be done with monkeys?,592
"Check it out, everyone is migrating to this new operating system!",592
I think they're all tweeting.,592
I just googled Snopes and both of these doctors are quacks.,592
I'm not sure you are the right fit for a job here at Twitter.,592
They’ve agreed on Duck Soup instead of Hamlet,592
It’s a waste of time. They’re all lame ducks.,592
"Well I'm not sure Quacks will replace Tweets, but it's an improvement over the Oink Campaign last month, and I do like their enthusiasm.",592
Let’s see if the unflavored keypads hold up any better.,592
Don't they know we can't type?,592
"Don't tell her husband about our time in the bathtub, okay!?!",592
"No, dummy. It's 'too be or not too be.'",592
I don`t think anyone ever asked them 'why' before.,592
"If it weren't double blind, you'ld already know which one is a duck.",592
It's not so much what she said as how she said it.,593
"No, my wife served the papers personally.",593
I'm pretty sure it's a final notice,593
"...oh, and there's a note from your mother.",593
‘Sharply worded’ would describe it.,593
"Actually, I would like to shoot the messenger.",593
"Hi honey, we just received the new Republican tax plan.",593
"Well, it doesn't feel like a metaphor.",593
"Yes, I am painfully aware of your terms and conditions.",593
"What I had actually said was ""Take a stab at it and get back to me""",593
I have reason to believe that my wife found our love letters.,593
At least she didn’t use bullet points.,593
"And I said, ""Divorce papers? Why not just stick a knife in my back?""",593
"To her credit, she did leave a note.",593
I'd like to switch to paperless statements.,593
Turns out they CAN pin it on me,593
"The stress is bearable, it's the paperwork that's killing me.",593
I think we can rule out reconciliation.,593
I've just received some painful news.,593
"I'm sorry, but Emma and I won't be able to make it to your murder mystery party. Clever invitation, by the way.",593
She knows.,593
My wife served the papers herself.,593
"No, I can't sit back and relax.",593
I got your text but I’m having trouble with the attachment.,593
"I wouldn't say it went well, but she did sign the divorce papers.",593
Remember when we thought there couldn't be anything worse than his tweets.,593
All I can say is that I did not see this coming.,593
"No, I haven't read it but I get the point.",593
I think the worst news is behind me.,593
"I can’t read it, but I got the message.",593
"No, I haven't read it yet, but I get the point.",593
"Yes, well I'm afraid I'm not in any position to read the fine print just now.",593
I remember them from last year. They must be perennials.,594
"Relax, they're just DRESSED like lumberjacks.",594
I love the fall when all their shirts turn plaid.,594
"Honestly? He's like, ten rings too old for her.",594
They've been in love since 1992. I know. Their initials are carved in my ass.,594
I just love watching them turn plaid in the fall.,594
Could I interest you in a treesome?,594
"You think that's weird, you should watch them pollinate.",594
"Look, Kevin, we're in a Cialis commercial!",594
"... And then their hair begins to lose its color, eventually falling off ...",594
There was a time when a beard and a checkered shirt would have made me nervous,594
"Surprise, surprise. The new manager is a fat white guy with no pants.",595
I can already tell he won't last.,595
He's not as bad as the last manager. That one was abominable.,595
They didn't say who...they just said one of us won't be here in the spring...,595
"It's not you, he's frosty to everyone.",595
I told him if he can't find his size to just wait a few minutes.,595
Either the constant staring stops or I'm cranking up the thermostat.,595
I hear he had a meltdown after the holidays last year,595
He's the very definition of seasonal help.,595
"If he asks you if you want to see his other carrot, just say no.",595
I think you misunderstood when I said to hire seasonal help.,595
He insists it's all water weight.,595
They set the temperature for just ONE employee while the rest of us freeze to death.,595
So he calls me into his office and when I get there he's wearing nothing but a scarf and a top hat,595
I guess the hiring freeze has officially started.,595
"He's fun, sure, but he won't last.",595
"If I wanted a boss with no pants, I'd have stayed in Hollywood.",595
"C’mon, live a little.",596
"C’mon, live a little.",596
"No, thanks. I'm just here to kill time.",596
Just one. I have to get up in the morning and you don't.,596
Last call? You have no idea.,596
Here's to you and taxes.,596
"Actually, I did leave my bag unattended for a few minutes. Why?",597
"Oh, we're not traveling. Our new health plan only covers X-rays done by TSA screening.",597
I’m allowed one suitcase and two personal items,597
I checked the fine print. There’s no fee for emotional baggage.,597
"So, while I was in Rome, I picked up a little Italian",597
This airline always loses my luggage. This time I'm counting on it.,597
He’s used to living out of a suitcase.,597
"If they lose him, I get $750.",597
I packed in a hurry this morning and just grabbed whatever was lying on the bed.,597
You should see how excited he gets when I pick him up at baggage claim.,597
I can't believe my baggage fit in my luggage.,597
He actually gets more legroom in there.,597
He says there's more legroom than in coach.,597
"I'm checking it to Chicago, Me, I'm going to Bermuda.",597
They think we're going on a trip but actually I'm taking them to be fixed.,597
Ted thought this girls' trip was a great idea. He even packed for me.,597
They settle down once they're in the overhead.,597
"Actually, they're both rescues.",597
I’m just happy to be away from my clingy boyfriend and his obnoxious dog.,597
I'm the fitness guru. The wisdom guru is one mountain over.,598
When I retired from Google they let me keep my chair.,598
It's for my back. You have two more questions.,598
"No, but I can show you the path to a tighter butt.",598
"Before I settled here, I bounced around a lot.",598
It turns out that inner peace is 95% core strength.,598
Enlightenment? I'm just trying to achieve alignment.,598
"The keys to a long life are balance and color, but mostly staying away from the edge.",598
"You only get one question and you ask, ""What's that?""!",598
I think there's a misunderstanding. I'm the Bally Lama.,598
I dreamt last night that some day judges might just require a small plastic bracelet,599
They’re known for their unconditional love.,599
"It's called a ""pet.""",599
I know he's extinct. Try telling him that.,599
Do you guys remember the code for the alarm?,599
I'm considered a flight risk.,599
Cave arrest isn't as comfy as I thought it would be,599
"I don't think this ""pet"" thing will ever catch on.",599
"Sure it hurts, but that’s fashion.",599
I was hoping for more of an emotional attachment.,599
Only if I think about it.,599
I parked in a toe-away zone.,599
He's very clingy.,599
He's very attached.,599
we all seem to have one eye,599
My security system has a few glitches.,599
I couldn't afford a fitbit.,599
Mental note. Don’t say “bite me”to a literalsaurus.,599
My wife got a matching bracelet.,599
Frankly he hasn't grasped the concept of 'heel' yet.,599
I can't wait until they invent a leash.,599
He's still teething. He'll evolve out of it.,599
These new ankle monitors are barely noticeable,599
Some extictions can't come soon enough.,599
"Nothing much, what's up with you two?",599
He's been extinct for 65 million years so I'm just as surprised to see him as you are.,599
"The wife wanted a dog, but those won’t be domesticated for another 3,000 years.",599
"No, go without me I shouldn't ignore this gnawing feeling.",599
The teething is killing me.,599
"I brought him home to eat, but I think he misunderstood.",599
It was a lot cuter as a puppy,599
He's been clingy ever since that asteroid last week.,599
The fines don’t even cover feeding the ankle monitor...,599
I didn't mind so much when he was smaller.,599
Right now we're both trying the Paleo thing.,599
Mission accomplished. We will report that this planet's inhabitants are friendly and playful.,600
"When I said abduct the dog, I meant President Trump...",600
"What is boy? A fire down by the old Jetson's house?""",600
Did you remember to take him out before we left?,600
"He agrees to a rectal probe, but only if we use our noses.",600
"My research on tail movements suggests he has to “go,” but I haven’t been able to determine what that means...",600
These earthlings are more intelligent than I thought they’d be.,600
"Tap...tap, tap. What does the code book say?",600
Thank goodness there's at least SOME intelligent life down there.,600
"I just said ""come"" and he came.",600
He looks too intelligent to account for what's going on down there.,600
He says he has business to do on earth.,600
I thought you were a cat person.,600
"I said beam up Scotty, not Spotty!",600
Now remember your mission: go infiltrate a human family and report back.,600
Did you bring your vaccination records with you?,600
"That’s right. Dog-light years are seven times longer, too.",600
These earth creatures are the most lovable and loyal species we've found in the universe.,600
It followed me home. Can I keep him?,600
They seem to have more leadership qualities than the other species.,600
Those beings I see you leading around must be an inferior species?,600
So you are saying if we offer belly rubs and squeaky toys we could take over the world?,600
"We've been monitoring Twitter so there'll be no, ""Take me to your leader.""",600
It’s their leader.,600
"Explain how your species has enslaved the humans, and we shall provide a treat.",600
"He says he has a wide-ranging interest in medieval and renaissance literature, but all he gets on earth is ""go fetch.""",600
"The four legs, long ears, sensitive nose and temperament are all improvements over the last Earthling we examined.",600
"What’s that, Sport? Timmy’s fallen down a black hole?!",600
"Back to your shithole planet, dog.",600
It seems his name is ‘sit.’,600
"Bear with me, I'm Sirius I have to get to the Dog Star to bury my bone.",600
"Then I get my dinner around 5 PM, relatively speaking.",600
Our research indicates that this is the highest life form on the planet.,600
"Daddy, can we eat... I mean keep him?",600
"Well, sure you can come live on our planet. We value kind, decent, honest life. Doesn’t everyone?",600
"I don't know either. I just heard this guy saying ""Beam me up a Scotty,"" and then this great whooshing sound, and now here I am.",600
"They seem friendly enough, but I was expecting opposable thumbs.",600
And who is going to walk him?,600
I know it's demeaning Johnson but if they ask- you're the good boy.,600
Our initial findings were wrong. There is intelligent life on this planet.,600
"The planet BigBones approaches, Lord Barker.",600
To boldly fetch where no dog has fetched before.,600
"This one is a common species, a rap artist, if I'm not mistaken.",600
"You thought it was just a big frisbee, didn't you boy, didn't you?",600
"We find it to be highly intelligent. It has domesticated a two legged creature to walk with it to clean up after it, and to bring it food.",600
"Ok! Now, we just need peanut butter.",600
Any news of Gérard Depardieu?,600
"Amazing, even their pets wear jewelry!",600
"Breeglot dooot phlom skiegor, Rex?",600
"Bark once for 'I'm really a dog"" and twice for ""It's a transporter screwup.",600
There really is a Dog!,600
Wait. Let me get this straight. The humans kidnapped you from your family and then did what to your genitals?,600
I think he is trying to tell us something.,600
A perfect apparatus for human domination!,600
Inform Commander Laika she has a visitor.,600
He appears to be from the planet K-9.,600
Sometimes those electromagnetic fences just don't work.,600
"Whatcha looking at? I'm just a dog. Ok, so I have a few fleas.",600
We've tried every language in the galaxy and we're no closer to knowing who's a good boy.,600
The earthlings have a very unusual method of greeting each other.,600
"Wow, they sure solved the hair loss problem!",600
Go get help!,600
"We took their best friend, of course they'll surrender.",600
I found him at a stripper bar. He was the only one with his tail on backwards.,600
"Well, you did say ""beam up the smartest thing at the White house"".",600
This was only species that responded to 'STAY!',600
I have deciphered the Best Friend of Human's tail message. He wants to play ball.,600
I stand corrected. There is intelligent life on earth after all.,600
If you ask me it's an antenna of some kind.,600
At last! Intelligent life on Earth.,600
"Stupid computer....I said ""retrieve HER.""",600
"It seems the only thing they can't figure out is ""Who's a good boy?""",600
"Contrary to what we thought, there is intelligent life down there.",600
"It seems to command a sizeable staff of chaperones, cooks, and exercisers, plus free rent and medical care...definitely the planet's alpha.",600
"You learned that men are from Mars, women are from Venus, and cats are from Uranus?",600
Apparently it is their 'best friend',600
ok who's turn is it to put on all the gear and take him out....,600
Earthlings are much more advanced in development than I anticipated.,600
"Good luck, agent Smith. We are confident the humans won’t suspect a thing.",600
"Careful, he probes with his snout.",600
"Well, what do you know? There really is a Dog.",600
This one actually listens.,600
I mentioned a cat scan and he looked at me like i was from outer space,600
He wants us to try the method his species uses to identify each other.,600
This one appears to be broken.,600
Where's the pony?,600
"Who’s the most intelligent life form on your planet? You are, yes you are!",600
Fly me to the moon.,600
Finally...an intelligent life form!,600
"Houston, we have a problem.",600
Your mission is to find Pluto and bring him back.,600
The dog tag says return to Sputnik.,600
He was the smartest one we could find in The White House.,600
What shithole planet are you from?,600
"It looks harmless,but they rule the Earthlings.",600
Pluto!,600
"That's right. Stand at ""Attention"". Good aliens!",600
Cute! Fun! How do earthlings get anything done?,600
Will someone please take this earthling to the poop deck!,600
"In outer space, nobody knows you're a dog.",600
And you say you know where this Dog Park is?,600
I still think that having him along to get us seven times faster in light years is not good science.,600
"We await your orders, Your Eminence.",600
"Our language experts say that wagging the tail is its way of saying ""Take me to your leader.""",600
"Awwww, he wuvs us.",600
That’s not a Scottie.,600
The creature radiates love. It's safe to land.,600
Man’s best friend is the perfect disguise.,600
I love the subtlety of their language.,600
So far our interrogation has determined that he's fluent in two languages - woof and arf!,600
How would you like to visit a world that's not dog-eat-dog?,600
