text,contest
It's settled. We'll keep him.,600
"Dammit Brork, not this kind of rover!",600
Fido: fetch the human.,600
"Normally we'd ask to be taken to your leader, but we've been monitoring your media broadcasts, and I think we'll just stay with you.",600
I thought you said it wouldn't need much attention.,601
"You know how they say that in the Spring, the desert comes alive?",601
We'll lose him in the swimming and biking stages.,601
Something tells me the peyote is staring to kick in.,601
I told you not to water it. Now it's going to follow us home.,601
Looks like we're not the only ones who want out before he builds that wall...,601
"Hon, remember that little cactus we let die on the window sill?",601
Next time just relieve yourself against a rock.,601
"Don't look now, but some prick is following us.",601
"Sorry, we only hug trees.",601
He just wants to say aloe.,601
The operation went well—you’re one tough cookie.,602
We ran a few tests and all the toothpicks came back clean,602
"In our opinion, you won't make it past the holidays.",602
Have you tried icing it?,602
I'm afraid the confection has spread.,602
It's not a ginger fracture. It's worse. It's a ginger snap.,602
I'm not going to sugarcoat this.,602
"I'm afraid, sir, since you were on the floor for more than five seconds, there's nothing we can do for you.",602
He's only known to us as John Dough.,602
Good news: it's just a yeast infection.,602
The results of your biopsy were delicious.,602
We have good news and bad news: You'll be home for Christmas.,602
Eyes still look glazed.,602
"You're fine, but they couldn't save the house.",602
"I’m afraid that IS the way it crumbles, sir.",602
Time to meet your baker.,602
You’re lucky. They usually bite the head off first.,602
"Your color is good, but your sugar level is high.",602
Were you battered as a child?,602
So the good news is we finally got your temperature down from 350 degrees.,602
Go home. Rest. Put some icing on it.,602
Have you tried icing it?,602
"I'm here to take a tissue sample...actually, we'd all like samples.",602
"Yes, thanks to a generous raisin donor, you can see again.",602
Good news. The Pillsbury Dough Boy is a match.,602
The fact that you survived the holidays is a good sign,602
We'd like to keep you here for further tasting.,602
"Look, there's just no way to sugar-coat this...",602
"You are a lucky man, considering that you had a temperature of 350 degrees for eight to ten minutes.",602
It's obviously gingervitis.,602
"Unfortunately, all of our wheelchairs are in use. We do have a dessert cart.",602
I'm afraid he's going to die of consumption.,602
"In case the surgery goes south, we're hoping that you consent to donating your body to the nurses break room.",602
The procedure will cost you an arm and a leg.,602
Prepare to meet your baker.,602
"Sir, you are one tough cookie.",602
It's a miracle that you survived. Your house was totally devoured.,602
"We're discharging you. I suggest that you run, run, as fast as you can.",602
"Your cholesterol and sugar levels are a little high, but you color's good and you smell delicious.",602
"Your sugar is too high, your fats are elevated, and , quite frankly, you’re a day too old.",602
The good news is we have a cure. The bad news is it'll cost you an arm and a leg.,602
"Actually, you're right. Everyone does want a piece of you.",602
"The patient won't tell us his name, so for the moment he's just John Dough.",602
"And tomorrow when you wake up, you'll be a gingerbread woman.",602
We're here to serve you.,602
"On a scale of 1 to 10, how crummy do you feel?",602
Welcome to the Culinary Care Unit.,602
This is the team that put Humpty Dumpty back together again.,602
We were wondering if we could take a few more samples.,602
Congratulations. You're now transginger.,602
"""I'm sorry, did you just say bite me?"".",602
You are one sick cookie.,602
It's a miracle you lasted through the holidays.,602
I'm not going to sugarcoat this.,602
"You'll be able to walk again, but only gingerly.",602
"Despite our best efforts, the confection is spreading.",602
You’d have the option to donate your body to science or to the bake sale.,602
They're here to take samples.,602
So. What's eating you?,602
"On the bright side, none of us thought you'd make it through Christmas.",602
We've decided to keep you here for another 20 minutes at 350 degrees.,602
You are one tough cookie.,602
I've done all I can do. It's time to meet your baker.,602
We're moving you to the cafeteria.,602
We had to remove your raisins.,602
We used to offer enlightenment. Then we discovered people really preferred brunch.,603
The path to true enlightenment is long and arduous. But you may wait at the bar.,603
Only you will truly know when your table is ready.,603
We don't have menus here. Everybody just gets what they deserve.,603
"My son, we all have reservations.",603
"The Meaning of Life? Oh, that's just the name of the restaurant.",603
"I have a one o'clock reservation, last name is Miller but I'm no longer a party of four.",603
Welcome to the Deli Lama.,603
"I know time is meaningless, but there is still a forty minute wait.",603
I can't seat you until you are fully present.,603
"The journey is long, my son, but the wait is even longer.",603
"All who seek enlightenment are welcome, but the restroom is for patrons only.",603
"No my son, you must come without reservations.",603
I can answer all the questions of the universe and all anyone wants to know is the Wi-Fi password.,603
Enlightenment is on Thursdays. Today is Taco Tuesday.,603
"I can validate your existence, but not your parking.",603
"Interesting, you came up this way. Most people use the escalator on the other side...",603
Welcome to the Deli Lama.,603
Words of wisdom? Don't get the chicken salad.,603
I’m sorry we’re a little busy. Maybe try off-peak.,603
They had reservations. You have two more questions.,603
The secret of life is call ahead.,603
"The food's good, but the atmosphere's a little thin.",603
I hope you have a tie in that back pack.,603
Party of oneness?,603
Good luck getting a table. I've been waiting here forever.,603
No Wi-Fi but we have a direct connection to the cloud.,603
We cannot make change for your $20; change comes from within.,603
"Enlightenment wasn't paying the bills, so we added a coffee shop.",603
"We can seat you outside or inside, it doesn’t matter. Nothing matters.",603
"You can come down, he's not the president anymore.",603
"Sorry, we only serve food for thought.",603
"If you want kosher, try that place over on Mt Sinai.",603
Trust me. One day your portrait will be used as the symbol of a political party even more primitive than we are.,604
I know what you're thinking -- don't quit hunting and gathering.,604
"Well, if you want a record of your existence, it’s either this or the tar pits.",604
You should have seen my parents when I told them I didn't want to be a hunter OR a gatherer.,604
"I'm calling it ""The Elephant in the Room""",604
It's SUPPOSED to be primitive!,604
"Don't worry, it's just a cave painting. No one will ever see it.",604
The drawing is the easy part. It's coming up with a caption that's tough.,604
It will be worth more when you're extinct.,604
How do you know it doesn't look like you?,604
"Son, your Mom and I want you back in the picture.",605
"Whatever you do, don’t take the stairs near the Escher painting!",605
The Demoiselles d’Avignon are out to lunch. We’re the McMurrays of Hackensack.,605
Imitating life. What are YOU doing?,605
It's creepy how his eyes are following us.,605
"Well you're no masterpiece yourself, pal.",605
"It says ""Man Looking Stupid"". What does yours say?",605
We kinda got drawn into it.,605
"Due to NEA budget cuts, the painting you would have seen here will be described by my wife, Ethel, her sister, Irene, and myself.",605
"As senior squeegee-man during flight simulations, moving up didn’t pan out.",606
"Yep, we're lost. We passed this guy an hour ago.",606
"He's always had his head in the clouds, but THIS ???",606
"OK, but he is going to have to check that bag.",606
It's the only way Delta lets you redeem their vouchers,606
"While stoned, he mistook a weather balloon for exhaust from a semi.",606
Jack had it all till the beanstalk died.,606
My only regret is that he never got around to visiting your mother.,607
He touched so many lives.,607
"Well, that just leaves taxes.",607
"You know, I can never define irony, but I know it when I see it.",607
I was hoping taxes would go first.,607
"Well, I guess that just leaves taxes.",607
He lived everyday like it was your last.,607
I wonder if he saw himself coming.,607
All they’d say is that it was job-related.,607
I guess we can stop eating kale.,607
I guess his work finally caught up with him.,607
"Well, he has no one to blame but himself for this.",607
I warned him not to run with that thing.,607
"Well, at least he died doing what he loved",607
They did a nice job. He looks grim.,607
"Well, he has no one to blame but himself.",607
I can’t believe Keith Richards outlived him.,607
"Well, that leaves taxes.",607
So where does this leave us on the “till death do us part” thing?,607
Does this mean your mother will be living with us forever?,607
I always hoped that Taxes would be the first to go.,607
Suddenly everyone has only good things to say about him.,607
He died doing what he loved.,607
"Then I said, ""would it kill you to smile now and then?""",607
Amazon puts everyone out of business.,607
To think how many lives he touched.,607
He had so much death left in him.,607
"Well, I guess we can start drinking and smoking again.",607
At least he died doing what he loved.,607
"In spite of everything, he stayed grim right up until the end.",607
I was really hoping Taxes would go first...,607
I hear the new guy has a weed wacker.,607
I guess you can be too good at your job.,607
"And that's when he said, 'Let me handle the N.R.A.'",607
The hard part was transposing from C major to Fahrenheit.,608
It's for when hell freezes over.,608
We need to screen our organ donors more closely.,608
Have you tried banging on it?,608
Is it too hot to Handel?,608
"The last guy played beautifully, but he couldn't handle the pressure.",608
No. I said streaming music.,608
When I get to that part where I talk about Hell turn it all the way up',608
You're right. It has a warmer sound.,608
The hissing is coming from the congregation.,608
Too hot to Handel.,608
"With our budget it was either heat or music, until I had a vision.",608
The man upstairs is complaining.,608
Exactly who did you call to fix the pipes?,608
It's right out of the Old Tenement.,608
All the other organists are going solar.,608
It has a nice warm sound to it,608
He really did appoint Chris Christie as Secretary of Transportation.,609
We can take this and transfer to the BLT at 42nd,609
You rarely see heroes in the subway anymore,609
"Next stop, New Deli.",609
Why does everything look like food when I am on a diet?,609
Let’s wait for the next train. Something’s not kosher with this one.,609
I think we're at the wrong Subway,609
I’m just relieved Subway outbid Trojan.,609
"You realize you’ve just wasted your last wish, don’t you?",609
"Budget cuts, service cuts, now, cold cuts?",609
Let's catch the next one. I hate being sandwiched in.,609
"I don't care, it's on time and we're taking it.",609
Next stop is the Mayo Clinic.,609
It's on time but it's not what I ordered,609
What's next? The gravy train?,609
If it touches the third rail it's toasted,609
Let's wait for the club car.,609
I'm going to need a moment to digest this.,609
It looks packed. Let's wait for the BLT.,609
If it touches the third rail it's toasted,609
They did say it would take a hero to fix the MTA...,609
'Bad news. They found the proof in the pudding.',610
"You can keep calling it ""flambé,"" but out here it's felony arson.",610
They're asking if you prefer gas or electric...,610
Beat until stiff meant the eggs.,610
The good news is they're letting you prepare your last meal.,610
"Cooking meth doesn't make you a chef, Steve.",610
For heaven's sake give them the recipe!,610
"On the bright side, he'll never give you a bad review again.",610
Prepare to serve ten to twenty.,610
"On the bright side, your ""Death by Chocolate"" exceeded expectations.",610
When you said you were going to grill the witness I had no idea.,610
"As White House chef, you must have been expecting this.",610
Good news. I found an attorney specializing in torte law.,610
"As the White House Chef, half the world is hailing you as a hero for at least attempting it.",610
No. I told you “poisson.”,610
"Evidently, the jury found it hard to swallow, too.",610
No one cares that the knife came out clean.,610
It doesn't look good. The butcher and the candlestick maker both took a plea.,610
You didn’t find it suspicious that they were selling oregano by the ounce?,610
They're making you out to be some kind of a butcher.,610
I guess the Times' restaurant critic has more clout than we realized.,610
"We're rebranding. ""Killer Chef"" is out. ""Serving Thyme"" is in.",610
You wouldn't be here if it wasn't for that little tart!,610
So who's the chef at Mar-a-lago now?,610
"On the positive side, you're the reason the prison cafeteria now has a Michelin rating.",610
For 30 years at home you never cooked. After two weeks in prison you're the chef?,610
"Everyone else got 12 years, for some reason you got 13.",610
You and I both know salt is the real killer.,610
"Honey, just tell them where you stashed the dough.",610
"When someone orders their steak well done, you have to learn to just let it go.",610
"Oh honey, 'shank' means something very different on the inside.",610
See if you can join the gang Martha Stewart was in,610
Have you decided...gas or electric?,610
Next time - just bake the gay wedding cake.,610
I distinctly said poisson!,610
The good news is you get to prepare your last meal.,610
"You're looking at 20 years, 15 if you use convection.",610
I couldn’t raise the dough.,610
"Believe me, I’ve tested a lot worse things when I was in pharmaceuticals.",611
"If he can be President, I can fly.",611
"""Fine, but for our second date you are coming sewer rafting"".",611
"Okay, just one more time to clarify...statues are worth 5, newly washed cars 25 and investment portfolio managers...125?",611
I don't know Mom. I'm starting to think maybe I was adopted.,611
"So he says “pigeons are just rats with wings.” And I was like, “whoa… Rats. With. Wings.”",611
"Yeah, but I identify as a pigeon.",611
"Dress for the job you want, not the job you have.",611
"So, all I do is land in the park and people toss food at me?",611
It was either this or fly United.,611
"You need good wings to fly; a lot of people don’t know that. I know wings. I’ve got the best wings! No one ever mentions that. No one has better wings, believe me! I’m going to do so much flying you’re going to get tired of seeing me flying!",611
"Well, you don't look like your profile either...",611
Wait... I was adopted?,611
And you poop at the same time?!,611
Either way I’ll be a smash on Broadway.,611
"Oh c'mon, Ratman and Robin. It writes itself!",611
Last question. I am your first student?,611
It's a textbook case--depending on which state your textbooks are from.,612
I suspect some people will deny this ever happened.,612
The coroner said it occurred sometime between 360 million years ago and 4am.,612
"It's Kansas, m'am. Evolution is a crime.",612
I wouldn't have expected this in a million years.,612
"Say what you will, he died a man.",612
This case goes back further than we thought.,612
"Mind you, it's just a theory.",612
Looks like the past finally caught up with him.,612
It's going to take a while to notify all the next of kin.,612
A billion years of evolution and they still don't look both ways...,612
Looks like a textbook case — except in Texas.,612
No jury in Tennessee will believe it.,612
We suspect the cause of death was natural selection.,612
We have to improve our response time.,612
"Well, at least we have a timeline.",612
Witnesses say it all started with a big bang.,612
Just when he got on his own two feet.,612
I'll tell you one thing. This killer took his time.,612
Looks to me like he was running from his past.,612
There's a missing link here somewhere...,612
"Obviously, it's an evolving crime scene.",612
Round up the usual fundamentalists.,612
Get Darwin from forensics on this. He may have a theory.,612
This didn't just happen over night.,612
"We're waiting on the DNA results, but believe they were all related.",612
Looks like his past caught up with him.,612
Looks like the crime took place some time between 600 Million B.C. and 3 A.M.,612
Looks like his past caught up with him.,612
This one has Darwin’s fingerprints all over it!,612
"Clearly, this is an evolving crime scene.",612
I guess we’ll see how this case evolves.,612
I can't help thinking we're missing a link here.,612
"""We've been trying to get a stoplight at this intersection since the beginning of time.'",612
We'll have to notify the next of species,612
"'Yeah, but why kill the other four? No way they were going to talk.'",612
"Well, at least we can rule out the evangelicals.",612
Our witness claims it started with a Big Bang.,612
I estimate time of death somewhere between 10pm last night and the Middle Devonian Period.,612
We think the victims are all related.,612
"Of course, it’s just a theory...",612
We've ruled out an act of God,612
Good luck establishing the time of death.,612
What a shame. He was making real progress.,612
This never happens in the Bible Belt.,612
God only knows what's next.,612
"Start questioning relatives, no matter how distant.",612
The neighbors said they first heard a big bang.,612
"We are authorized to use farce, if necessary.",613
"Unless you want a very long ride in a very small car, I suggest you start talking.",613
"Oh, you'll laugh. They all laugh.",613
Don't make us go for the juggler.,613
"If you think he's a clown, wait until you meet your public defender.",613
I’m going to need you to describe the perp to our balloon artist.,613
“I’m the carrot. He’s the stchick”.,613
"If you want to see a giraffe, we're going to need more a lot more information.",613
"You are in Canada sir. Its good cop, funny cop.",613
Does it look like we're joking?,613
"Johnson, I don't think you understand. I am the good cop.",613
"No, I said to play with more attitude.",614
Your lesson was yesterday.,614
The Zen Way is on the next mountain. This is the Steinway.,614
I know you didn't send for a tuner. The people down in the valley did.,614
The public is saying your latest work is inaccessible.,614
Everyone wants the secret of life. No one asks how the hell I got this baby up here.,614
The Craigslist ad said it's free if I pick it up myself...?,614
"Finally, a request.",614
I'm moving all of my music to the cloud.,614
"To be honest with you, we regret both the promise of free delivery and the promise of lifetime tunings.",614
"The meaning of life? No I don't know it, but maybe if you hum a few bars...",614
Is this the Steinway to Heaven?,614
Well that was a major scale!,614
You find out who your real friends are when you ask them to help you move.,614
"Franz, just call it ""Unfinished"" and come down.",614
With a helicopter. You've got two questions left.,614
"Sorry to tell you this; the divorce is now final, and she got the piano.",614
"I know you're discouraged by the turnout, but I think it's the venue.",614
Am I late for my lesson?,614
"I guess if you can make it here, you can make it anywhere.",614
There've been complaints about the hills being alive with the sound of music.,614
I see that no one but you plays at this level.,614
How 'bout this time I show you how to tune the piano yourself?,614
Big deal! Try it with a piano on your back.,614
"I can hear the wife now: ""You caught it, you clean it.""",615
Must be another Trump hotel that's underwater,615
I've finally caught something my wife will let me hang in the living room.,615
"""I hate fishing in the Hamptons"".",615
Too bad it's catch and release. My wife would love this.,615
We must be at Pier 1.,615
You're gonna need a nicer boat.,615
"Finally, something my wife will let me mount in the living room.",615
Those fish are having a ball down there.,615
Now I wish I hadn't thrown back that Chippendale table.,615
It's the Trump lure -- it works best with bottom feeders.,615
Throw it back; we're fishing for mid-century modern.,615
"First, I set the mood.",615
I tie my own. Why do you ask?,615
Is that chandelier going to keep getting bigger every time you tell this story?,615
I'm not surprised. A lot of upscale homes are now underwater.,615
I think I’ll mount this one on the ceiling.,615
I’ve advised my client not to talk.,616
I've got corporate up my ass on this one John...,616
I want to report inappropriate touching.,616
Of course he had a hand in this!,616
I need you to order all of the 'For Dummies' books on this list.,616
"Trust me, I speak for both of us.",616
Do you have any idea who you're talking to?,616
"His words, not mine.",616
We want time-and-a-half.,616
Could you take care of this? The boss is breathing down my neck.,616
The memo speaks for itself. Which is more than I can say for Brad here.,616
Ignore him. You now report directly to me.,616
"Read the memo from HR, Fred. From now on, I'm a ""vocally enabled support mannequin,"" not a ""dummy.""",616
"If he goes, I go.",616
"It's pretty much boilerplate, but if you have questions I'll be in the brown suitcase under Phil's desk.",616
Here's my resignation. I just don't feel like I have a voice here.,616
At least I know I'm a puppet.,616
How do you explain this invoice for a wood chipper?,616
I need to speak with you. Alone.,616
Ancestry.com says your desk is my uncle.,616
The coward behind me. That's who's firing you.,616
I'm his right-hand man.,616
"You aren’t the first person in this bureau to be fired by a dummy, and you won’t be the last!",616
This is the list of grievances from an employee who wishes to remain anonymous.,616
But before we head down... a short fire-safety video...,617
"No, this is Purgatory. Hell has FOX 24/7.",617
I wonder if he moved that pitchfork a little left would we get better reception?,617
"No, purgatory. In hell, it's Fox News 24/7.",617
It gets worse. The commercials are for air conditioning.,617
It's either this or the PBS pledge drive.,617
I didn’t know there would be an orientation video.,617
It's not really eternal - if you watch closely it's a forty-five minute loop.,617
I hear the 1% get real fire...,617
This is boring as hell.,617
"No, only the Catholics have real flames. We’re all Episcopalians.",617
Is it wrong to say you look hot?,617
He wants to make Hell great again.,617
"Good news! If this were hell, they'd be showing Fox News.",617
"This is it? Well, I'll be damned!",617
I guess it didn't really matter if I had on clean underwear after all.,617
"No, you ask him to change the channel.",617
They've been making due with this ever since the place froze over in 2016.,617
"One channel, one show, no remote, welcome to hell!",617
So this is ironic... last week I was standing next to a fire and watching naked people on TV.,617
It's a live feed from the White House.,617
It gets worse. In February they start showing reruns of The Apprentice.,617
Sometimes he changes the channel to Hannity,617
We only get two stations. Fire and Brimstone.,617
"Did you give to the Trump campaign, too?",617
We're all Congressional staff. White House is two circles down.,617
The last thing I remember was accepting a White House appointment.,617
666 channels and nothing is on.,617
"Strangely enough, you are the first person to ask about the clock.",618
Well of course they don’t exist. Now.,618
It’s on the enchanted species list.,618
The damn thing had been leaving rainbows all over my lawn.,618
"Well, sure, but I never would have believed in a Trump presidency, either.",618
"And this is a unicorn, a rare being most don’t even believe exists. Come to think of it, you have a lot in common with him, Black Guy In A New Yorker Cartoon.",618
I figured nobody would believe me so I shot it.,618
Bagged the Emu while on Safari. Bagged the unicorn while on LSD.,618
It's hard to get off a good shot once that carousel gets moving.,618
It was hit or myth.,618
I glued the horn on. I didn't want the grand-kids to know I accidentally shot a horse.,618
Where did you get the clock?,618
"I also have a centaur, but it makes people uncomfortable.",618
"And then, just when I thought he'd gotten away, the carousel circled around again and I got a clean shot.",618
Some say they are extinct. Some don’t believe they ever existed at all. It’s called an “Analog Clock”.,618
Of course I felt bad...I was aiming for the leprechaun.,618
Turns out they're magical but not particularly swift.,618
"In my defense, it came out of nowhere.",618
I found it in the same place where Fox News gets its stories.,618
I’m still cleaning the glitter out of the truck.,618
Killing this one took some imagination.,618
Most people thought it didn't exist. And now it doesn't.,618
Coney Island carousel; 1969. Got him on the rise.,618
It was a very hostile takeover.,619
It was a very hostile takeover.,619
"The pen is mightier, but that looks awesome.",619
If you can remove it... it means your heart is pure. But you can no longer work in sales.,619
I think there's been a mistake. I asked management to give him the axe.,619
I thought 'willing to work knights' was just a typo.,619
Now we are at the last task of your interview.,619
"Also, if you can pull the stuck page out of the copier you become the rightful Head of Finance.",619
"No, not the sword. The test is to pull out the middle drawer.",619
You can have Damocles' old desk.,619
The pen is taking it pretty hard.,619
